{
  "id": "wrestlemania",
  "displayName": "WrestleMania",
  "previewImage": "assets/textures/arena/previews/preview-wrestlemania.png",
  "stage": "raw_is_war",
  "floor": "assets/glb/arena/floor/arena_floor.glb",
  "barricade": "assets/glb/arena/barricade/barricade.glb",
  "outer": "assets/glb/arena/outer/arena_outer.glb",
  "arenaTextures": {
    "mat_floor_ringside": "assets/textures/arena/floor_ringside/floor_mat_1_double.png",
    "mat_ringside_barricade": "assets/textures/arena/floor_ringside/floor_mat_1_double.png"
  },
  "ringTextures": {
    "mat_rope_top": "assets/textures/ring/rope/rope.png",
    "mat_rope_middle": "assets/textures/ring/rope/rope.png",
    "mat_rope_bottom": "assets/textures/ring/rope/rope.png",
    "ropeTopColor": "rgba(0, 0, 0, 0.75)",
    "ropeMiddleColor": "rgba(0, 0, 0, 0.75)",
    "ropeBottomColor": "rgba(0, 0, 0, 0.75)",
    "turnbucklePadColor": "rgba(0, 0, 0, 1)",
    "turnbuckleBoltCoverColor": "rgba(0, 0, 0, 0)"
  }
}
